{
 "expect": "accept",
 "input": {
  "call": {
   "args": {
    "tally": {
     "acc": 1788400010,
     "call": "UQWFdAPUwhvOpBIWLnIJIujHt9u57xpzpQGNwY8Yudw",
     "err": null,
     "op": "travel/charge",
     "out": "Ptl0zsFSzJ9AXfresvriJt6EcD1ccuIHeJi-uPxHDcA",
     "rev": {
      "until": 1788486400
     },
     "sig": "fundQmzV8_oiMBHWWDlznZkWLAR7nSeatT2YUjIOZwfWpLpD8IGCB3A60kFfzVZOhwuNm-8WArPsR_KRmXgqDA",
     "st": "ok",
     "sub": [],
     "typ": "tally",
     "used": {
      "amount": 58900
     },
     "v": 1,
     "writ": "Wjxqd7hNCOyVKynHaMFi9AeTkZTsgY8xB7pUfW3UwHA",
     "wrt": []
    }
   },
   "chain": [
    {
     "bnd": {
      "act": {
       "t": "prefix",
       "v": "travel"
      },
      "amount": {
       "t": "max",
       "v": 60000
      },
      "currency": {
       "t": "set",
       "v": [
        "USD"
       ]
      },
      "date": {
       "t": "window",
       "v": [
        20261015,
        20261019
       ]
      },
      "fare": {
       "t": "set",
       "v": [
        "refundable"
       ]
      },
      "uses": {
       "t": "count",
       "v": 1
      }
     },
     "exp": 1788403600,
     "hld": "did:key:z6Mko9hTggMwjSTEaJaPUfE6tqcy2xvU6BnNq3e3o8qVBiyH",
     "iss": "did:key:z6Mkon3Necd6NkkyfoGoHxid2znGc59LU3K7mubaRcFbLfLX",
     "nnc": "bm9uY2UtMDAwMDAwMDAwMQ",
     "prv": null,
     "sig": "c4aTx2-QmNlj9rm7l2SYWhDFyZOp_DVPBNlAer6MrL0nQxmj-Rt68Ey6PFh1rXZuCqXcvDx5gL49SkilzkvfCw",
     "typ": "writ",
     "v": 1
    },
    {
     "bnd": {
      "act": {
       "t": "prefix",
       "v": "travel/charge"
      },
      "amount": {
       "t": "max",
       "v": 58900
      },
      "currency": {
       "t": "set",
       "v": [
        "USD"
       ]
      },
      "date": {
       "t": "window",
       "v": [
        20261015,
        20261015
       ]
      },
      "fare": {
       "t": "set",
       "v": [
        "refundable"
       ]
      },
      "uses": {
       "t": "count",
       "v": 1
      }
     },
     "exp": 1788401800,
     "hld": "did:key:z6MkvRXNYcE7MMduynWTgeKbDaT1iijDSC8pZqXZc8rHPrf2",
     "iss": "did:key:z6Mko9hTggMwjSTEaJaPUfE6tqcy2xvU6BnNq3e3o8qVBiyH",
     "nnc": "bm9uY2UtMDAwMDAwMDAwMg",
     "prv": "zpKUMDs2vGseN-2U9LHKrEhRfOrXYRr7x8O6DEO4g7U",
     "sig": "yVka3FzI2TbD42_qnZgVOit6pshRr4xfpnsn83jpNOFLAxX9u89KDUcluGExTD2UUXrS2Ugnm6tGRzsAxQSqDQ",
     "typ": "writ",
     "v": 1
    }
   ],
   "from": "did:key:z6Mkon3Necd6NkkyfoGoHxid2znGc59LU3K7mubaRcFbLfLX",
   "id": "bm9uY2UtMDAwMDAwMDA0MQ",
   "op": "sys/undo",
   "sig": "Ee-xCUbWQfoqI081YJbzRTdAyCfEhw9TBiYzzedD9dGGeOABbCZkvfCT5lXGkO8QTpN-kMazrdgnmrVKUTSDBQ",
   "typ": "call",
   "v": 1
  },
  "res": {
   "refund": "rf_0001"
  },
  "tally": {
   "acc": 1788403660,
   "call": "VpeUAp2PW3w6n5_tfNk0Y9HW8O_1AgDjODuDSCMcYUM",
   "err": null,
   "op": "sys/undo",
   "out": "4FRxWPFal1GyTYZeiBv2Bp9f3ni92FNZEBE6QIjar7U",
   "rev": null,
   "sig": "d93wZfIByeDJN9GEIa-A0cUZTDDMEOte8lOaRdmMRNFIBAwQ_SwteZQ70mLUKOGnkkGU5rb3Jayf9GwofaMiCA",
   "st": "ok",
   "sub": [],
   "typ": "tally",
   "used": {},
   "v": 1,
   "writ": "Wjxqd7hNCOyVKynHaMFi9AeTkZTsgY8xB7pUfW3UwHA",
   "wrt": []
  },
  "writ": {
   "bnd": {
    "act": {
     "t": "prefix",
     "v": "travel/charge"
    },
    "amount": {
     "t": "max",
     "v": 58900
    },
    "currency": {
     "t": "set",
     "v": [
      "USD"
     ]
    },
    "date": {
     "t": "window",
     "v": [
      20261015,
      20261015
     ]
    },
    "fare": {
     "t": "set",
     "v": [
      "refundable"
     ]
    },
    "uses": {
     "t": "count",
     "v": 1
    }
   },
   "exp": 1788401800,
   "hld": "did:key:z6MkvRXNYcE7MMduynWTgeKbDaT1iijDSC8pZqXZc8rHPrf2",
   "iss": "did:key:z6Mko9hTggMwjSTEaJaPUfE6tqcy2xvU6BnNq3e3o8qVBiyH",
   "nnc": "bm9uY2UtMDAwMDAwMDAwMg",
   "prv": "zpKUMDs2vGseN-2U9LHKrEhRfOrXYRr7x8O6DEO4g7U",
   "sig": "yVka3FzI2TbD42_qnZgVOit6pshRr4xfpnsn83jpNOFLAxX9u89KDUcluGExTD2UUXrS2Ugnm6tGRzsAxQSqDQ",
   "typ": "writ",
   "v": 1
  }
 },
 "name": "undo tally acc after exp",
 "op": "verify_tally"
}