{
 "expect": "reject",
 "input": {
  "call": {
   "args": {
    "amount": 58900,
    "currency": "USD",
    "date": 20261015,
    "fare": "refundable"
   },
   "chain": [
    {
     "bnd": {
      "act": {
       "t": "prefix",
       "v": "travel"
      },
      "amount": {
       "t": "max",
       "v": 60000
      },
      "currency": {
       "t": "set",
       "v": [
        "USD"
       ]
      },
      "date": {
       "t": "window",
       "v": [
        20261015,
        20261019
       ]
      },
      "fare": {
       "t": "set",
       "v": [
        "refundable"
       ]
      },
      "uses": {
       "t": "count",
       "v": 1
      }
     },
     "exp": 1788403600,
     "hld": "did:key:z6Mko9hTggMwjSTEaJaPUfE6tqcy2xvU6BnNq3e3o8qVBiyH",
     "iss": "did:key:z6Mkon3Necd6NkkyfoGoHxid2znGc59LU3K7mubaRcFbLfLX",
     "nnc": "bm9uY2UtMDAwMDAwMDAwMQ",
     "prv": null,
     "sig": "c4aTx2-QmNlj9rm7l2SYWhDFyZOp_DVPBNlAer6MrL0nQxmj-Rt68Ey6PFh1rXZuCqXcvDx5gL49SkilzkvfCw",
     "typ": "writ",
     "v": 1
    },
    {
     "bnd": {
      "act": {
       "t": "prefix",
       "v": "travel/charge"
      },
      "amount": {
       "t": "max",
       "v": 58900
      },
      "currency": {
       "t": "set",
       "v": [
        "USD"
       ]
      },
      "date": {
       "t": "window",
       "v": [
        20261015,
        20261015
       ]
      },
      "fare": {
       "t": "set",
       "v": [
        "refundable"
       ]
      },
      "uses": {
       "t": "count",
       "v": 1
      }
     },
     "exp": 1788401800,
     "hld": "did:key:z6MkvRXNYcE7MMduynWTgeKbDaT1iijDSC8pZqXZc8rHPrf2",
     "iss": "did:key:z6Mko9hTggMwjSTEaJaPUfE6tqcy2xvU6BnNq3e3o8qVBiyH",
     "nnc": "bm9uY2UtMDAwMDAwMDAwMg",
     "prv": "zpKUMDs2vGseN-2U9LHKrEhRfOrXYRr7x8O6DEO4g7U",
     "sig": "yVka3FzI2TbD42_qnZgVOit6pshRr4xfpnsn83jpNOFLAxX9u89KDUcluGExTD2UUXrS2Ugnm6tGRzsAxQSqDQ",
     "typ": "writ",
     "v": 1
    }
   ],
   "from": "did:key:z6Mko9hTggMwjSTEaJaPUfE6tqcy2xvU6BnNq3e3o8qVBiyH",
   "id": "bm9uY2UtMDAwMDAwMDAyNQ",
   "op": "travel/chargeback",
   "sig": "0wsLQ5fhWczkEapAoGGtE2DXQrHhbahRN0PWyL8kJfKBIuv2cqCxYsjhjJAaxC9UYOT0izAvQZCZ38innCHsCw",
   "typ": "call",
   "v": 1
  }
 },
 "name": "op segment escape",
 "now": 1788400010,
 "op": "verify_call",
 "reason": "forbidden_op"
}