{
 "expect": "accept",
 "input": {
  "call": {
   "args": {
    "amount": 30000,
    "currency": "USD"
   },
   "chain": [
    {
     "bnd": {
      "act": {
       "t": "prefix",
       "v": "pay"
      },
      "amount": {
       "t": "total",
       "v": 60000
      },
      "currency": {
       "t": "set",
       "v": [
        "USD"
       ]
      }
     },
     "exp": 1788403600,
     "hld": "did:key:z6Mko9hTggMwjSTEaJaPUfE6tqcy2xvU6BnNq3e3o8qVBiyH",
     "iss": "did:key:z6Mkon3Necd6NkkyfoGoHxid2znGc59LU3K7mubaRcFbLfLX",
     "nnc": "bm9uY2UtMDAwMDAwMDEwMw",
     "prv": null,
     "sig": "V4OQwqF3fTKUIDWJpuUXoI-vgYblx5mNtZXz9ueO-2lTfMSpZxbkktlQsbZAXrKBgcx6wLxHX24VMSykw7w4CA",
     "typ": "writ",
     "v": 1
    }
   ],
   "from": "did:key:z6Mkon3Necd6NkkyfoGoHxid2znGc59LU3K7mubaRcFbLfLX",
   "id": "bm9uY2UtMDAwMDAwMDEwOQ",
   "op": "pay",
   "sig": "H0qFTdcrwJoryFCHt9YwZkoNiC-bikgeSTDHJlBzNw33tg00rmjbjO7bGaabU-XNM04sstbEm8zCoTwnUoUcAw",
   "typ": "call",
   "v": 1
  },
  "tally": {
   "acc": 1788400005,
   "call": "3QgdCKeE2f_NW1YjKK0MY53ROZqYy_JDMzQUDLF0n9Q",
   "err": null,
   "op": "pay",
   "out": null,
   "rev": null,
   "sig": "GnMyRgxQ95jqCLWpSUv2_xCTjZ7oAEC544q8lRmH9GX60OP-sJFYvZeUt-nHeV-6aT-6L_ffynJg3078Ryo7AQ",
   "st": "ok",
   "sub": [
    {
     "acc": 1788400010,
     "call": "z5eKIObnfRVfbvR8PlJkgsk965QkJM1KtliiJtG0HxU",
     "err": null,
     "op": "pay",
     "out": null,
     "rev": null,
     "sig": "oujbCYm6-CS59wjdE1kETVlJOWPixYL2rlGJCavK3hpoqLCR5uMYoQmxF1uiud1P3VJ2AWgsAN1yqXp60byHAw",
     "st": "ok",
     "sub": [],
     "typ": "tally",
     "used": {
      "amount": 20000
     },
     "v": 1,
     "writ": "W9BP_pRDw746k37kewV7BL3_1Sz4VW5GE98fMJ5pwaQ",
     "wrt": []
    },
    {
     "acc": 1788400011,
     "call": "ozpodCevQVYiLu2bXPZ_xOx2IY9INm7PAYMSZiW14AY",
     "err": null,
     "op": "pay",
     "out": null,
     "rev": null,
     "sig": "sBuJi17mWyNaX4sC0t2bu0HMV68TdmBq2AG7h2zIodXlzp0OMRqN8vuGXZlfHOCelrm2_3HVvbr3_zcOx-xFBQ",
     "st": "ok",
     "sub": [],
     "typ": "tally",
     "used": {
      "amount": 15000
     },
     "v": 1,
     "writ": "W9BP_pRDw746k37kewV7BL3_1Sz4VW5GE98fMJ5pwaQ",
     "wrt": []
    }
   ],
   "typ": "tally",
   "used": {
    "amount": 35000
   },
   "v": 1,
   "writ": "fKroHdQKVjFpAXYaiP0FlTRYuttrSFIIpqrLkiGQ5h4",
   "wrt": [
    {
     "bnd": {
      "act": {
       "t": "prefix",
       "v": "pay"
      },
      "amount": {
       "t": "total",
       "v": 20000
      },
      "currency": {
       "t": "set",
       "v": [
        "USD"
       ]
      }
     },
     "exp": 1788401800,
     "hld": "did:key:z6MkvRXNYcE7MMduynWTgeKbDaT1iijDSC8pZqXZc8rHPrf2",
     "iss": "did:key:z6Mko9hTggMwjSTEaJaPUfE6tqcy2xvU6BnNq3e3o8qVBiyH",
     "nnc": "bm9uY2UtMDAwMDAwMDEwNA",
     "prv": "fKroHdQKVjFpAXYaiP0FlTRYuttrSFIIpqrLkiGQ5h4",
     "sig": "cgi_TO5-tVeo8aQwGRR324cvSbKDaHSm9viKYUfrKyWNFpC705LU4JM84mPRnzDtczGpPuXv34Bg3Iw-XFCmBg",
     "typ": "writ",
     "v": 1
    }
   ]
  },
  "writ": {
   "bnd": {
    "act": {
     "t": "prefix",
     "v": "pay"
    },
    "amount": {
     "t": "total",
     "v": 60000
    },
    "currency": {
     "t": "set",
     "v": [
      "USD"
     ]
    }
   },
   "exp": 1788403600,
   "hld": "did:key:z6Mko9hTggMwjSTEaJaPUfE6tqcy2xvU6BnNq3e3o8qVBiyH",
   "iss": "did:key:z6Mkon3Necd6NkkyfoGoHxid2znGc59LU3K7mubaRcFbLfLX",
   "nnc": "bm9uY2UtMDAwMDAwMDEwMw",
   "prv": null,
   "sig": "V4OQwqF3fTKUIDWJpuUXoI-vgYblx5mNtZXz9ueO-2lTfMSpZxbkktlQsbZAXrKBgcx6wLxHX24VMSykw7w4CA",
   "typ": "writ",
   "v": 1
  }
 },
 "name": "tally tree within a total",
 "op": "verify_tally"
}