{
 "expect": "reject",
 "input": {
  "writ": {
   "bnd": {
    "act": {
     "t": "prefix",
     "v": "travel"
    },
    "amount": {
     "t": "max",
     "v": 60000
    },
    "currency": {
     "t": "set",
     "v": [
      "USD"
     ]
    },
    "date": {
     "t": "window",
     "v": [
      20261015,
      20261019
     ]
    },
    "fare": {
     "t": "set",
     "v": [
      "refundable"
     ]
    },
    "huge": {
     "t": "set",
     "v": [
      "member-0000",
      "member-0001",
      "member-0002",
      "member-0003",
      "member-0004",
      "member-0005",
      "member-0006",
      "member-0007",
      "member-0008",
      "member-0009",
      "member-0010",
      "member-0011",
      "member-0012",
      "member-0013",
      "member-0014",
      "member-0015",
      "member-0016",
      "member-0017",
      "member-0018",
      "member-0019",
      "member-0020",
      "member-0021",
      "member-0022",
      "member-0023",
      "member-0024",
      "member-0025",
      "member-0026",
      "member-0027",
      "member-0028",
      "member-0029",
      "member-0030",
      "member-0031",
      "member-0032",
      "member-0033",
      "member-0034",
      "member-0035",
      "member-0036",
      "member-0037",
      "member-0038",
      "member-0039",
      "member-0040",
      "member-0041",
      "member-0042",
      "member-0043",
      "member-0044",
      "member-0045",
      "member-0046",
      "member-0047",
      "member-0048",
      "member-0049",
      "member-0050",
      "member-0051",
      "member-0052",
      "member-0053",
      "member-0054",
      "member-0055",
      "member-0056",
      "member-0057",
      "member-0058",
      "member-0059",
      "member-0060",
      "member-0061",
      "member-0062",
      "member-0063",
      "member-0064",
      "member-0065",
      "member-0066",
      "member-0067",
      "member-0068",
      "member-0069",
      "member-0070",
      "member-0071",
      "member-0072",
      "member-0073",
      "member-0074",
      "member-0075",
      "member-0076",
      "member-0077",
      "member-0078",
      "member-0079",
      "member-0080",
      "member-0081",
      "member-0082",
      "member-0083",
      "member-0084",
      "member-0085",
      "member-0086",
      "member-0087",
      "member-0088",
      "member-0089",
      "member-0090",
      "member-0091",
      "member-0092",
      "member-0093",
      "member-0094",
      "member-0095",
      "member-0096",
      "member-0097",
      "member-0098",
      "member-0099",
      "member-0100",
      "member-0101",
      "member-0102",
      "member-0103",
      "member-0104",
      "member-0105",
      "member-0106",
      "member-0107",
      "member-0108",
      "member-0109",
      "member-0110",
      "member-0111",
      "member-0112",
      "member-0113",
      "member-0114",
      "member-0115",
      "member-0116",
      "member-0117",
      "member-0118",
      "member-0119",
      "member-0120",
      "member-0121",
      "member-0122",
      "member-0123",
      "member-0124",
      "member-0125",
      "member-0126",
      "member-0127",
      "member-0128",
      "member-0129",
      "member-0130",
      "member-0131",
      "member-0132",
      "member-0133",
      "member-0134",
      "member-0135",
      "member-0136",
      "member-0137",
      "member-0138",
      "member-0139",
      "member-0140",
      "member-0141",
      "member-0142",
      "member-0143",
      "member-0144",
      "member-0145",
      "member-0146",
      "member-0147",
      "member-0148",
      "member-0149",
      "member-0150",
      "member-0151",
      "member-0152",
      "member-0153",
      "member-0154",
      "member-0155",
      "member-0156",
      "member-0157",
      "member-0158",
      "member-0159",
      "member-0160",
      "member-0161",
      "member-0162",
      "member-0163",
      "member-0164",
      "member-0165",
      "member-0166",
      "member-0167",
      "member-0168",
      "member-0169",
      "member-0170",
      "member-0171",
      "member-0172",
      "member-0173",
      "member-0174",
      "member-0175",
      "member-0176",
      "member-0177",
      "member-0178",
      "member-0179",
      "member-0180",
      "member-0181",
      "member-0182",
      "member-0183",
      "member-0184",
      "member-0185",
      "member-0186",
      "member-0187",
      "member-0188",
      "member-0189",
      "member-0190",
      "member-0191",
      "member-0192",
      "member-0193",
      "member-0194",
      "member-0195",
      "member-0196",
      "member-0197",
      "member-0198",
      "member-0199",
      "member-0200",
      "member-0201",
      "member-0202",
      "member-0203",
      "member-0204",
      "member-0205",
      "member-0206",
      "member-0207",
      "member-0208",
      "member-0209",
      "member-0210",
      "member-0211",
      "member-0212",
      "member-0213",
      "member-0214",
      "member-0215",
      "member-0216",
      "member-0217",
      "member-0218",
      "member-0219",
      "member-0220",
      "member-0221",
      "member-0222",
      "member-0223",
      "member-0224",
      "member-0225",
      "member-0226",
      "member-0227",
      "member-0228",
      "member-0229",
      "member-0230",
      "member-0231",
      "member-0232",
      "member-0233",
      "member-0234",
      "member-0235",
      "member-0236",
      "member-0237",
      "member-0238",
      "member-0239",
      "member-0240",
      "member-0241",
      "member-0242",
      "member-0243",
      "member-0244",
      "member-0245",
      "member-0246",
      "member-0247",
      "member-0248",
      "member-0249",
      "member-0250",
      "member-0251",
      "member-0252",
      "member-0253",
      "member-0254",
      "member-0255",
      "member-0256",
      "member-0257",
      "member-0258",
      "member-0259",
      "member-0260",
      "member-0261",
      "member-0262",
      "member-0263",
      "member-0264",
      "member-0265",
      "member-0266",
      "member-0267",
      "member-0268",
      "member-0269",
      "member-0270",
      "member-0271",
      "member-0272",
      "member-0273",
      "member-0274",
      "member-0275",
      "member-0276",
      "member-0277",
      "member-0278",
      "member-0279",
      "member-0280",
      "member-0281",
      "member-0282",
      "member-0283",
      "member-0284",
      "member-0285",
      "member-0286",
      "member-0287",
      "member-0288",
      "member-0289",
      "member-0290",
      "member-0291",
      "member-0292",
      "member-0293",
      "member-0294",
      "member-0295",
      "member-0296",
      "member-0297",
      "member-0298",
      "member-0299",
      "member-0300",
      "member-0301",
      "member-0302",
      "member-0303",
      "member-0304",
      "member-0305",
      "member-0306",
      "member-0307",
      "member-0308",
      "member-0309",
      "member-0310",
      "member-0311",
      "member-0312",
      "member-0313",
      "member-0314",
      "member-0315",
      "member-0316",
      "member-0317",
      "member-0318",
      "member-0319",
      "member-0320",
      "member-0321",
      "member-0322",
      "member-0323",
      "member-0324",
      "member-0325",
      "member-0326",
      "member-0327",
      "member-0328",
      "member-0329",
      "member-0330",
      "member-0331",
      "member-0332",
      "member-0333",
      "member-0334",
      "member-0335",
      "member-0336",
      "member-0337",
      "member-0338",
      "member-0339",
      "member-0340",
      "member-0341",
      "member-0342",
      "member-0343",
      "member-0344",
      "member-0345",
      "member-0346",
      "member-0347",
      "member-0348",
      "member-0349",
      "member-0350",
      "member-0351",
      "member-0352",
      "member-0353",
      "member-0354",
      "member-0355",
      "member-0356",
      "member-0357",
      "member-0358",
      "member-0359",
      "member-0360",
      "member-0361",
      "member-0362",
      "member-0363",
      "member-0364",
      "member-0365",
      "member-0366",
      "member-0367",
      "member-0368",
      "member-0369",
      "member-0370",
      "member-0371",
      "member-0372",
      "member-0373",
      "member-0374",
      "member-0375",
      "member-0376",
      "member-0377",
      "member-0378",
      "member-0379",
      "member-0380",
      "member-0381",
      "member-0382",
      "member-0383",
      "member-0384",
      "member-0385",
      "member-0386",
      "member-0387",
      "member-0388",
      "member-0389",
      "member-0390",
      "member-0391",
      "member-0392",
      "member-0393",
      "member-0394",
      "member-0395",
      "member-0396",
      "member-0397",
      "member-0398",
      "member-0399"
     ]
    },
    "uses": {
     "t": "count",
     "v": 1
    }
   },
   "exp": 1788403600,
   "hld": "did:key:z6Mko9hTggMwjSTEaJaPUfE6tqcy2xvU6BnNq3e3o8qVBiyH",
   "iss": "did:key:z6Mkon3Necd6NkkyfoGoHxid2znGc59LU3K7mubaRcFbLfLX",
   "nnc": "bm9uY2UtMDAwMDAwMDAwMQ",
   "prv": null,
   "sig": "q3GspbddV8S5UpEQ_7SlUpOMTrwgqkeowh1UwfX0SQGOEATC9jTCWieAmAFm2PvZR9iHArt9qUFDuvz6FGewCA",
   "typ": "writ",
   "v": 1
  }
 },
 "name": "writ over 4096 bytes",
 "op": "verify_writ",
 "reason": "too_large"
}