{
 "expect": "reject",
 "input": {
  "writ": {
   "bnd": {
    "act": {
     "t": "prefix",
     "v": "travel"
    },
    "amount": {
     "t": "max",
     "v": 60000
    },
    "currency": {
     "t": "set",
     "v": [
      "USD"
     ]
    },
    "date": {
     "t": "window",
     "v": [
      20261015,
      20261019
     ]
    },
    "fare": {
     "t": "set",
     "v": [
      "refundable"
     ]
    },
    "uses": {
     "t": "count",
     "v": 1
    }
   },
   "exp": 1788403600,
   "hld": "did:key:z6Mko9hTggMwjSTEaJaPUfE6tqcy2xvU6BnNq3e3o8qVBiyH",
   "iss": "did:key:z6Mkon3Necd6NkkyfoGoHxid2znGc59LU3K7mubaRcFbLfLX",
   "nnc": "tooshort",
   "prv": null,
   "sig": "iv4xXs7a3f6Jf3xU6uGtLeIsbtOUdGOts93w9IzheYh1MF6xGLdHhEXeNm_l6Y_Tf0C6dhJXc_kUdb1B1f-5Dw",
   "typ": "writ",
   "v": 1
  }
 },
 "name": "short nonce",
 "op": "verify_writ",
 "reason": "malformed"
}