{
 "expect": "reject",
 "input": {
  "chain": [
   {
    "bnd": {
     "act": {
      "t": "prefix",
      "v": "travel"
     },
     "amount": {
      "t": "max",
      "v": 60000
     },
     "currency": {
      "t": "set",
      "v": [
       "USD"
      ]
     },
     "date": {
      "t": "window",
      "v": [
       20261015,
       20261019
      ]
     },
     "fare": {
      "t": "set",
      "v": [
       "refundable"
      ]
     },
     "uses": {
      "t": "count",
      "v": 1
     }
    },
    "exp": 1788403600,
    "hld": "did:key:z6Mko9hTggMwjSTEaJaPUfE6tqcy2xvU6BnNq3e3o8qVBiyH",
    "iss": "did:key:z6Mkon3Necd6NkkyfoGoHxid2znGc59LU3K7mubaRcFbLfLX",
    "nnc": "bm9uY2UtMDAwMDAwMDAwMQ",
    "prv": null,
    "sig": "c4aTx2-QmNlj9rm7l2SYWhDFyZOp_DVPBNlAer6MrL0nQxmj-Rt68Ey6PFh1rXZuCqXcvDx5gL49SkilzkvfCw",
    "typ": "writ",
    "v": 1
   },
   {
    "bnd": {
     "act": {
      "t": "prefix",
      "v": "travel/charge"
     },
     "amount": {
      "t": "max",
      "v": 58900
     },
     "currency": {
      "t": "set",
      "v": [
       "USD"
      ]
     },
     "date": {
      "t": "window",
      "v": [
       20261015,
       20261015
      ]
     },
     "fare": {
      "t": "set",
      "v": [
       "refundable"
      ]
     },
     "uses": {
      "t": "count",
      "v": 1
     }
    },
    "exp": 1788401800,
    "hld": "did:key:z6MkvRXNYcE7MMduynWTgeKbDaT1iijDSC8pZqXZc8rHPrf2",
    "iss": "did:key:z6Mko9hTggMwjSTEaJaPUfE6tqcy2xvU6BnNq3e3o8qVBiyH",
    "nnc": "bm9uY2UtMDAwMDAwMDAwMg",
    "prv": "AAAAAAAAAAAAAAAAAAAAAAAAAAAAAAAAAAAAAAAAAAA",
    "sig": "rF8HmfnWRbuDnl7SXCyZiAmU-dD-jh5XSOQ23Db6tf6QuAqcGTkLrTPjHbkBEfVHhYy8V_S7cjjkGV70_cqTDg",
    "typ": "writ",
    "v": 1
   }
  ]
 },
 "name": "prv mismatch",
 "op": "verify_chain",
 "reason": "chain_broken"
}