{
 "expect": "reject",
 "input": {
  "writ": {
   "bnd": {
    "amount": {
     "t": "max",
     "v": 60000
    },
    "currency": {
     "t": "set",
     "v": [
      "USD"
     ]
    },
    "date": {
     "t": "window",
     "v": [
      20261015,
      20261019
     ]
    },
    "fare": {
     "t": "set",
     "v": [
      "refundable"
     ]
    },
    "uses": {
     "t": "count",
     "v": 1
    }
   },
   "exp": 1788403600,
   "hld": "did:key:z6Mko9hTggMwjSTEaJaPUfE6tqcy2xvU6BnNq3e3o8qVBiyH",
   "iss": "did:key:z6Mkon3Necd6NkkyfoGoHxid2znGc59LU3K7mubaRcFbLfLX",
   "nnc": "bm9uY2UtMDAwMDAwMDAwMQ",
   "prv": null,
   "sig": "LYdx1C9qYEG5VJgNO0NNzvkPFEd6Y3GepVMuo5BIiGY55kKI_MbyPfJGeZkavyNzi9MK7TdbOhfGojsFGVz1DA",
   "typ": "writ",
   "v": 1
  }
 },
 "name": "missing act",
 "op": "verify_writ",
 "reason": "malformed"
}